{
  "id": "research-assistant",
  "title": "Trustworthy Research Assistant With Verified Citations",
  "description": "An improved RAG architecture that grounds answers in uploaded papers, verifies citations, and routes important outputs through review.",
  "version": "1.0.0",
  "user_idea": "Build a trustworthy research assistant that can read papers, answer questions, and provide verified citations.",
  "assumptions": [
    "Uploaded papers may contain private notes or unpublished work.",
    "Answers must cite retrieved paper passages.",
    "Human review is required before high-trust external use."
  ],
  "task_profile": {
    "task_type": "research_assistant",
    "risk_level": "high",
    "knowledge_intensity": "high",
    "requires_tools": false,
    "requires_memory": false,
    "requires_human_review": true,
    "requires_citations": true,
    "privacy_sensitivity": "high"
  },
  "naive_baseline": {
    "summary": "User question goes directly to one LLM, which returns an answer without retrieval, source trace, citation checks, or review.",
    "failure_modes": [
      "Invented citations or unsupported claims can reach the user.",
      "Private uploaded material has no retention or deletion policy.",
      "There is no reviewer for important research outputs."
    ]
  },
  "nodes": [
    {
      "id": "document_upload",
      "type": "input",
      "name": "Document Upload",
      "description": "Collects papers or notes that the assistant is allowed to use.",
      "inputs": [],
      "outputs": [
        {
          "name": "uploaded_documents",
          "description": "User-provided papers and notes.",
          "sensitive": true,
          "format": "pdf_or_text"
        }
      ],
      "config": {
        "accepted_formats": ["pdf", "txt", "markdown"],
        "max_files": 10
      },
      "risks": [
        {
          "risk_type": "private_upload",
          "severity": "warning",
          "description": "Uploaded papers may include private or unpublished information.",
          "mitigation": "Show retention assumptions and avoid storing documents longer than needed."
        }
      ],
      "cost_estimate": {
        "relative": "none",
        "notes": "No model cost at upload time."
      },
      "latency_estimate": {
        "relative": "low",
        "notes": "Upload latency depends on document size.",
        "estimated_seconds": 2
      },
      "alternatives": [
        {
          "name": "Paste abstract only",
          "tradeoff": "Lower privacy exposure but weaker grounding.",
          "when_to_use": "Use when the full paper cannot be uploaded."
        }
      ],
      "explanation_for_beginner": "This is the door where trusted source material enters the system.",
      "position": { "x": 0, "y": 0 }
    },
    {
      "id": "text_extraction",
      "type": "transform",
      "name": "Text Extraction",
      "description": "Converts uploaded files into plain text and metadata.",
      "inputs": [
        {
          "name": "uploaded_documents",
          "description": "Raw uploaded files.",
          "sensitive": true
        }
      ],
      "outputs": [
        {
          "name": "document_text",
          "description": "Extracted text with page or section metadata.",
          "sensitive": true,
          "format": "structured_text"
        }
      ],
      "config": {
        "preserve_page_numbers": true,
        "strip_binary_content": true
      },
      "risks": [
        {
          "risk_type": "extraction_error",
          "severity": "warning",
          "description": "Poor extraction can lose tables, formulas, or citation context.",
          "mitigation": "Keep page metadata and expose extraction uncertainty."
        }
      ],
      "cost_estimate": {
        "relative": "low",
        "notes": "Usually a local parsing cost."
      },
      "latency_estimate": {
        "relative": "medium",
        "notes": "Large PDFs may take several seconds.",
        "estimated_seconds": 5
      },
      "alternatives": [
        {
          "name": "Manual text paste",
          "tradeoff": "More effort for the user but fewer parsing errors."
        }
      ],
      "explanation_for_beginner": "The system cannot search PDFs well until their words are extracted.",
      "position": { "x": 220, "y": 0 }
    },
    {
      "id": "chunking",
      "type": "transform",
      "name": "Chunking",
      "description": "Splits long document text into smaller searchable sections.",
      "inputs": [
        {
          "name": "document_text",
          "description": "Extracted document text with metadata.",
          "sensitive": true
        }
      ],
      "outputs": [
        {
          "name": "document_chunks",
          "description": "Searchable chunks with source metadata.",
          "sensitive": true,
          "format": "chunk_list"
        }
      ],
      "config": {
        "target_tokens": 700,
        "overlap_tokens": 100
      },
      "risks": [
        {
          "risk_type": "lost_context",
          "severity": "warning",
          "description": "Chunks can split claims from their supporting evidence.",
          "mitigation": "Use overlap and keep paper, page, and section metadata."
        }
      ],
      "cost_estimate": {
        "relative": "low",
        "notes": "Local text processing."
      },
      "latency_estimate": {
        "relative": "low",
        "notes": "Fast for small document sets.",
        "estimated_seconds": 1
      },
      "alternatives": [
        {
          "name": "Section-aware chunking",
          "tradeoff": "Better context but more implementation effort."
        }
      ],
      "explanation_for_beginner": "Chunking turns large papers into bite-sized pieces that retrieval can find.",
      "position": { "x": 440, "y": 0 }
    },
    {
      "id": "embedding",
      "type": "transform",
      "name": "Embedding",
      "description": "Creates vector representations for each chunk.",
      "inputs": [
        {
          "name": "document_chunks",
          "description": "Chunked document text.",
          "sensitive": true
        }
      ],
      "outputs": [
        {
          "name": "chunk_vectors",
          "description": "Embeddings linked to chunk metadata.",
          "sensitive": true,
          "format": "vector_records"
        }
      ],
      "config": {
        "embedding_model": "text-embedding-small",
        "batching": true
      },
      "risks": [
        {
          "risk_type": "model_cost",
          "severity": "warning",
          "description": "Embedding many documents can create repeated cost.",
          "mitigation": "Cache embeddings and avoid recomputing unchanged documents."
        }
      ],
      "cost_estimate": {
        "relative": "medium",
        "notes": "Embedding cost grows with document volume.",
        "units_per_run": 1
      },
      "latency_estimate": {
        "relative": "medium",
        "notes": "Batching reduces total wait time.",
        "estimated_seconds": 6
      },
      "alternatives": [
        {
          "name": "Keyword index",
          "tradeoff": "Cheaper and simpler, but misses semantic matches."
        }
      ],
      "explanation_for_beginner": "Embeddings make similar ideas close together so the system can retrieve relevant passages.",
      "position": { "x": 660, "y": 0 }
    },
    {
      "id": "knowledge_base",
      "type": "knowledge_base",
      "name": "Knowledge Base",
      "description": "Stores chunk text, vectors, source metadata, and retention settings.",
      "inputs": [
        {
          "name": "chunk_vectors",
          "description": "Embedded chunks and source metadata.",
          "sensitive": true
        }
      ],
      "outputs": [
        {
          "name": "searchable_corpus",
          "description": "Indexed knowledge for retrieval.",
          "sensitive": true,
          "format": "vector_index"
        }
      ],
      "config": {
        "retention_policy": "delete on project reset or user request",
        "source_metadata": ["paper_title", "page", "section"]
      },
      "risks": [
        {
          "risk_type": "retention",
          "severity": "error",
          "description": "Private uploads need clear storage and deletion expectations.",
          "mitigation": "Expose retention policy and deletion control in the implementation plan."
        }
      ],
      "cost_estimate": {
        "relative": "low",
        "notes": "Storage cost is modest for a demo corpus."
      },
      "latency_estimate": {
        "relative": "low",
        "notes": "Index lookup should be fast after ingestion.",
        "estimated_seconds": 1
      },
      "alternatives": [
        {
          "name": "Session-only index",
          "tradeoff": "Better privacy but users must re-upload documents."
        }
      ],
      "explanation_for_beginner": "The knowledge base is the assistant's approved library.",
      "position": { "x": 880, "y": 0 }
    },
    {
      "id": "user_question",
      "type": "input",
      "name": "User Question",
      "description": "Receives the research question to answer.",
      "inputs": [],
      "outputs": [
        {
          "name": "question",
          "description": "The user's question about the uploaded papers.",
          "format": "text"
        }
      ],
      "config": {
        "require_question_text": true
      },
      "risks": [
        {
          "risk_type": "ambiguous_question",
          "severity": "warning",
          "description": "Ambiguous questions can produce broad or unsupported answers.",
          "mitigation": "Ask for clarification when the retrieval query is too vague."
        }
      ],
      "cost_estimate": {
        "relative": "none",
        "notes": "No model cost at input time."
      },
      "latency_estimate": {
        "relative": "none",
        "notes": "Immediate user input."
      },
      "alternatives": [